{
  "revision": 179,
  "backburner": [
    {
      "id": "legacy-task-L73",
      "title": "**Rotate the OpenCart administrator password** — owner: Douglas; decision id: `mtu-opencart-credential-rotation-20260730`. The credential was exposed in a prior session transcript; rotate the Ecwid credential too.",
      "project": "kelly-uniforms-business",
      "suggested_track": "business-continuity",
      "suggested_capability": "rebuild-ready-recovery",
      "entry_depth": "D0",
      "discovered_from": "TASK.md:L73",
      "relationship": "follow-up",
      "dependencies": [],
      "blockers": [],
      "conflicts": [],
      "value": "low",
      "risk": "low",
      "evidence": [
        {
          "receipt_id": "8c206419-f4ca-465e-ad79-07a810afd101",
          "verifier": "inspection",
          "subject": "legacy-task-L73",
          "result": "verified",
          "reference": ".agents\\work\\imports\\legacy-TASK.39ae36c38d44be2f874bae13717854e8b086feeecc12f57053d8af8c6466bbad.md",
          "sha256": "39ae36c38d44be2f874bae13717854e8b086feeecc12f57053d8af8c6466bbad",
          "size_bytes": 17343,
          "captured_at": "2026-08-09T06:14:31.4184718Z"
        },
        {
          "receipt_id": "08c45cf7-265f-458f-a4ee-0f4983310238",
          "verifier": "source",
          "subject": "mtu-opencart-credential-rotation-20260730",
          "result": "verified",
          "reference": "SOURCES.md",
          "sha256": "3369d6b8688c99f79d5e1e226f51a36eb8bae6004551a390a8f13bf55b52a618",
          "size_bytes": 23480,
          "captured_at": "2026-08-09T20:41:15.3680025Z"
        }
      ],
      "status": "rejected",
      "captured_at": "2026-08-09T06:14:31.4218327Z"
    },
    {
      "id": "legacy-task-L74",
      "title": "Authenticated export and banner work — owner: Douglas; decision id: `mtu-production-access-path-20260806`. The preserved OpenCart tab and the Ecwid/Clover tabs resolve to login screens with no saved autofill. Resume through a fresh signed-in handoff or the approved broker; never copy a plaintext password into agent-visible input.",
      "project": "kelly-uniforms-business",
      "suggested_track": "business-continuity",
      "suggested_capability": "rebuild-ready-recovery",
      "entry_depth": "D0",
      "discovered_from": "TASK.md:L74",
      "relationship": "follow-up",
      "dependencies": [],
      "blockers": [],
      "conflicts": [],
      "value": "low",
      "risk": "low",
      "evidence": [
        {
          "receipt_id": "64c4bb33-98f7-42d3-a8c1-aca8c0f399ea",
          "verifier": "inspection",
          "subject": "legacy-task-L74",
          "result": "verified",
          "reference": ".agents\\work\\imports\\legacy-TASK.39ae36c38d44be2f874bae13717854e8b086feeecc12f57053d8af8c6466bbad.md",
          "sha256": "39ae36c38d44be2f874bae13717854e8b086feeecc12f57053d8af8c6466bbad",
          "size_bytes": 17343,
          "captured_at": "2026-08-09T06:14:31.422282Z"
        },
        {
          "receipt_id": "8777ceff-29e8-41b9-9bd9-df63f71c0f01",
          "verifier": "source",
          "subject": "mtu-production-access-path-20260806",
          "result": "verified",
          "reference": "SOURCES.md",
          "sha256": "3369d6b8688c99f79d5e1e226f51a36eb8bae6004551a390a8f13bf55b52a618",
          "size_bytes": 23480,
          "captured_at": "2026-08-09T20:42:45.5306987Z"
        }
      ],
      "status": "rejected",
      "captured_at": "2026-08-09T06:14:31.4231762Z"
    },
    {
      "id": "legacy-task-L75",
      "title": "Path B (unattended Bitwarden-brokered login) — blocked on: Douglas. Create the four `mtuniforms.*` secrets in the `Agent Runtime` Bitwarden project, grant the machine account read access, run `Set-BwsMachineToken.ps1`, and return the non-secret project ID plus four resource IDs. (`bws.exe` 2.1.0 is checksum-verified; broker Playwright self-test passed; the pipeline stops at credential retrieval.)",
      "project": "kelly-uniforms-business",
      "suggested_track": "business-continuity",
      "suggested_capability": "rebuild-ready-recovery",
      "entry_depth": "D0",
      "discovered_from": "TASK.md:L75",
      "relationship": "follow-up",
      "dependencies": [],
      "blockers": [
        "Legacy [!] item remains explicitly blocked."
      ],
      "conflicts": [],
      "value": "low",
      "risk": "low",
      "evidence": [
        {
          "receipt_id": "f1d471be-279f-49e9-8331-3951813a7f23",
          "verifier": "inspection",
          "subject": "legacy-task-L75",
          "result": "verified",
          "reference": ".agents\\work\\imports\\legacy-TASK.39ae36c38d44be2f874bae13717854e8b086feeecc12f57053d8af8c6466bbad.md",
          "sha256": "39ae36c38d44be2f874bae13717854e8b086feeecc12f57053d8af8c6466bbad",
          "size_bytes": 17343,
          "captured_at": "2026-08-09T06:14:31.4235201Z"
        }
      ],
      "status": "blocked",
      "captured_at": "2026-08-09T06:14:31.4238314Z"
    },
    {
      "id": "legacy-task-L76",
      "title": "Apply nginx 301 www → non-www — blocked on: hosting access and confirmation that the TLS certificate covers `www.mtuniforms.com`.",
      "project": "kelly-uniforms-business",
      "suggested_track": "business-continuity",
      "suggested_capability": "rebuild-ready-recovery",
      "entry_depth": "D0",
      "discovered_from": "TASK.md:L76",
      "relationship": "follow-up",
      "dependencies": [],
      "blockers": [
        "Legacy [!] item remains explicitly blocked."
      ],
      "conflicts": [],
      "value": "low",
      "risk": "low",
      "evidence": [
        {
          "receipt_id": "ccc89cf3-293a-48f9-b1c9-6f1410418637",
          "verifier": "inspection",
          "subject": "legacy-task-L76",
          "result": "verified",
          "reference": ".agents\\work\\imports\\legacy-TASK.39ae36c38d44be2f874bae13717854e8b086feeecc12f57053d8af8c6466bbad.md",
          "sha256": "39ae36c38d44be2f874bae13717854e8b086feeecc12f57053d8af8c6466bbad",
          "size_bytes": 17343,
          "captured_at": "2026-08-09T06:14:31.4240777Z"
        }
      ],
      "status": "blocked",
      "captured_at": "2026-08-09T06:14:31.4244404Z"
    },
    {
      "id": "legacy-task-L80",
      "title": "Confirm `orders@mtuniforms.com` is monitored and ready for order intake — owner: Kelly or David; decision id: `mtu-orders-mailbox-readiness-20260808`.",
      "project": "kelly-uniforms-business",
      "suggested_track": "business-continuity",
      "suggested_capability": "rebuild-ready-recovery",
      "entry_depth": "D0",
      "discovered_from": "TASK.md:L80",
      "relationship": "follow-up",
      "dependencies": [],
      "blockers": [],
      "conflicts": [],
      "value": "low",
      "risk": "low",
      "evidence": [
        {
          "receipt_id": "464a60f3-4828-4209-a518-8d0a9d9f83f9",
          "verifier": "inspection",
          "subject": "legacy-task-L80",
          "result": "verified",
          "reference": ".agents\\work\\imports\\legacy-TASK.39ae36c38d44be2f874bae13717854e8b086feeecc12f57053d8af8c6466bbad.md",
          "sha256": "39ae36c38d44be2f874bae13717854e8b086feeecc12f57053d8af8c6466bbad",
          "size_bytes": 17343,
          "captured_at": "2026-08-09T06:14:31.4249448Z"
        },
        {
          "receipt_id": "6e17e71b-2cbd-4c5a-9fe4-8565e216d21c",
          "verifier": "source",
          "subject": "Douglas rulings 2026-08-09",
          "result": "verified",
          "reference": "SOURCES.md",
          "sha256": "3369d6b8688c99f79d5e1e226f51a36eb8bae6004551a390a8f13bf55b52a618",
          "size_bytes": 23480,
          "captured_at": "2026-08-09T20:43:06.9396181Z"
        }
      ],
      "status": "closed",
      "captured_at": "2026-08-09T06:14:31.4254479Z"
    },
    {
      "id": "legacy-task-L81",
      "title": "Confirm `(814) 536-2390` reaches the intended order-taking line — owner: Kelly or David; decision id: `mtu-order-phone-readiness-20260808`.",
      "project": "kelly-uniforms-business",
      "suggested_track": "business-continuity",
      "suggested_capability": "rebuild-ready-recovery",
      "entry_depth": "D0",
      "discovered_from": "TASK.md:L81",
      "relationship": "follow-up",
      "dependencies": [],
      "blockers": [],
      "conflicts": [],
      "value": "low",
      "risk": "low",
      "evidence": [
        {
          "receipt_id": "156b8bf7-e984-40a8-a38f-7e2be5137ed3",
          "verifier": "inspection",
          "subject": "legacy-task-L81",
          "result": "verified",
          "reference": ".agents\\work\\imports\\legacy-TASK.39ae36c38d44be2f874bae13717854e8b086feeecc12f57053d8af8c6466bbad.md",
          "sha256": "39ae36c38d44be2f874bae13717854e8b086feeecc12f57053d8af8c6466bbad",
          "size_bytes": 17343,
          "captured_at": "2026-08-09T06:14:31.4257997Z"
        },
        {
          "receipt_id": "786dc28d-d477-4639-a4b7-f4b79f4b4073",
          "verifier": "source",
          "subject": "Douglas rulings 2026-08-09",
          "result": "verified",
          "reference": "SOURCES.md",
          "sha256": "3369d6b8688c99f79d5e1e226f51a36eb8bae6004551a390a8f13bf55b52a618",
          "size_bytes": 23480,
          "captured_at": "2026-08-09T20:43:09.4278367Z"
        }
      ],
      "status": "closed",
      "captured_at": "2026-08-09T06:14:31.426089Z"
    },
    {
      "id": "legacy-task-L82",
      "title": "Choose the production access path — owner: Douglas; decision id: `mtu-production-access-path-20260806`.",
      "project": "kelly-uniforms-business",
      "suggested_track": "business-continuity",
      "suggested_capability": "rebuild-ready-recovery",
      "entry_depth": "D0",
      "discovered_from": "TASK.md:L82",
      "relationship": "follow-up",
      "dependencies": [],
      "blockers": [],
      "conflicts": [],
      "value": "low",
      "risk": "low",
      "evidence": [
        {